### DISCUSSION TITLE
Pro Server - Machines register but show "not neady"

### DISCUSSION THREAD

**Discussion by bearkiter** [rustdesk/rustdesk#11729] [Q&A]
I have the server setup in Digital Ocean, AFAIK all the ports 21110 to 21120 are open (can telnet on 2118 and access http on 21114)
Machines show up in the client based on group etc fine, but cannot be connected to. I have the relay running on the same VM and have configured both, and the API.

I get "failed to connect via rendezvous server" in the client when trying to connect. I have paid a year in advance for the license, and am not new to Linux or open source.

Not running dockers, running the .sh installer version.

**Comment by rustdesk** [comment]
Coud you paste the access log of the controlled side client?

https://github.com/rustdesk/rustdesk/wiki/FAQ#access-logs

**Comment by rustdesk** [comment]
@fufesou follow it up

**Comment by bearkiter** [comment]
[2025-05-12 12:37:44.091327 +10:00] DEBUG [libs\hbb_common\src\udp.rs:36] Receive buf size of udp 0.0.0.0:0: Ok(65536)
[2025-05-12 12:37:44.091704 +10:00] INFO [src\rendezvous_mediator.rs:595] register_pk of muirrust due to key not confirmed
[2025-05-12 12:38:15.049475 +10:00] INFO [src\rendezvous_mediator.rs:595] register_pk of muirrust due to key not confirmed

Seem most relevant? Would it not complain if the key was incorrect at time of setting it? The key is copied from the server WEBUI

**Reply by rustdesk** [reply]
It seems UDP 21116 not working. Make sure UDP 21116 is open on server side (muirrust.com), it is UDP, not normal TCP.

**Comment by bearkiter** [comment]
UFW:
root@muirrust:~# ufw status numbered
Status: active

     To                         Action      From
     --                         ------      ----
[ 1] 21115:21119/tcp            ALLOW IN    Anywhere
[ 2] 22/tcp                     ALLOW IN    Anywhere
[ 3] 21116/udp                  ALLOW IN    Anywhere
[ 4] 21114:21119/tcp            ALLOW IN    Anywhere
[ 5] 8000/tcp                   ALLOW IN    Anywhere
[ 6] 21115:21119/tcp (v6)       ALLOW IN    Anywhere (v6)
[ 7] 22/tcp (v6)                ALLOW IN    Anywhere (v6)
[ 8] 21116/udp (v6)             ALLOW IN    Anywhere (v6)
[ 9] 21114:21119/tcp (v6)       ALLOW IN    Anywhere (v6)
[10] 8000/tcp (v6)              ALLOW IN    Anywhere (v6)

DO Firewall: 
All everything (testing)

Type | Protocol | Port Range | Sources |  
All TCP | TCP | All ports | All IPv4 All IPv6 | More
SSH | TCP | 22 | All IPv4 All IPv6 | More
All UDP | UDP | All ports | All IPv4 All IPv6 | More


Netstat:
Active Internet connections (only servers)
Proto Recv-Q Send-Q Local Address           Foreign Address         State
tcp        0      0 10.126.0.41:domain      0.0.0.0:*               LISTEN
tcp        0      0 muirrust.dugongc:domain 0.0.0.0:*               LISTEN
tcp        0      0 _localdnsproxy:domain   0.0.0.0:*               LISTEN
tcp        0      0 localhost:domain        0.0.0.0:*               LISTEN
tcp        0      0 172.17.0.1:domain       0.0.0.0:*               LISTEN
tcp        0      0 _localdnsstub:domain    0.0.0.0:*               LISTEN
tcp        0      0 localhost:953           0.0.0.0:*               LISTEN
tcp        0      0 muirrust:domain         0.0.0.0:*               LISTEN
tcp6       0      0 localhost:domain        [::]:*                  LISTEN
tcp6       0      0 [::]:ssh                [::]:*                  LISTEN
tcp6       0      0 muirrust:domain         [::]:*                  LISTEN
tcp6       0      0 [::]:21115              [::]:*                  LISTEN
tcp6       0      0 [::]:21114              [::]:*                  LISTEN
tcp6       0      0 [::]:21119              [::]:*                  LISTEN
tcp6       0      0 [::]:21118              [::]:*                  LISTEN
tcp6       0      0 [::]:21117              [::]:*                  LISTEN
tcp6       0      0 [::]:21116              [::]:*                  LISTEN
tcp6       0      0 muirrust:domain         [::]:*                  LISTEN
tcp6       0      0 localhost:953           [::]:*                  LISTEN

**Reply by fufesou** [reply]
Hi, can you login on the client?

![image](https://github.com/user-attachments/assets/8adec0bf-aa00-4fbe-9c3b-9a97f71e4673)

If you can't, it seems the server is not configured correctly.

If you can, could please capture the network traffic on the client and the server, udp 21116?

**Reply by bearkiter** [reply]
Yes, can login, list machines, attempt connections, add to favourites, browse by device group, see other users listed etc.
![image](https://github.com/user-attachments/assets/e69f65c8-563f-4f3b-814b-b6aa8bb66187)

**Reply by fufesou** [reply]
@bearkiter Can I connect your server? Please send me an email if I can. `bGlubG9uZzEyNjZAZ21haWwuY29t` base64 encoded.

**Comment by bearkiter** [comment]
root@muirrust:~# cat dump.txt
03:48:05.210571 IP 220-233-36-47.ip4.exetel.com.au.8664 > muirrust.21116: Flags [S], seq 1835726896, win 65535, options [mss 1460,nop,wscale 8,nop,nop,sackOK], length 0
03:48:05.210638 IP muirrust.21116 > 220-233-36-47.ip4.exetel.com.au.8664: Flags [S.], seq 4135548916, ack 1835726897, win 64240, options [mss 1460,nop,nop,sackOK,nop,wscale 7], length 0
03:48:05.229149 IP 220-233-36-47.ip4.exetel.com.au.8461 > muirrust.21116: UDP, length 85
03:48:05.229347 IP muirrust.dugongcr.com.21116 > 220-233-36-47.ip4.exetel.com.au.8461: UDP, length 3
03:48:05.231491 IP 220-233-36-47.ip4.exetel.com.au.8664 > muirrust.21116: Flags [.], ack 1, win 255, length 0
03:48:05.231492 IP 220-233-36-47.ip4.exetel.com.au.8664 > muirrust.21116: Flags [F.], seq 1, ack 1, win 255, length 0
03:48:05.231770 IP muirrust.21116 > 220-233-36-47.ip4.exetel.com.au.8664: Flags [P.], seq 1:104, ack 2, win 502, length 103
03:48:05.231805 IP muirrust.21116 > 220-233-36-47.ip4.exetel.com.au.8664: Flags [F.], seq 104, ack 2, win 502, length 0
03:48:05.252434 IP 220-233-36-47.ip4.exetel.com.au.8664 > muirrust.21116: Flags [.], ack 1, win 255, length 0
03:48:05.252434 IP 220-233-36-47.ip4.exetel.com.au.8664 > muirrust.21116: Flags [R.], seq 2, ack 104, win 0, length 0
03:48:07.399839 IP 220-233-36-47.ip4.exetel.com.au.8603 > muirrust.21116: UDP, length 85
03:48:07.399992 IP muirrust.dugongcr.com.21116 > 220-233-36-47.ip4.exetel.com.au.8603: UDP, length 5
03:48:11.396888 IP 220-233-36-47.ip4.exetel.com.au.8603 > muirrust.21116: UDP, length 85
03:48:11.397076 IP muirrust.dugongcr.com.21116 > 220-233-36-47.ip4.exetel.com.au.8603: UDP, length 3
03:48:11.546608 IP 220-233-36-47.ip4.exetel.com.au.8538 > muirrust.21116: Flags [S], seq 3567626985, win 65535, options [mss 1460,nop,wscale 8,nop,nop,sackOK], length 0
03:48:11.546675 IP muirrust.21116 > 220-233-36-47.ip4.exetel.com.au.8538: Flags [S.], seq 3513397962, ack 3567626986, win 64240, options [mss 1460,nop,nop,sackOK,nop,wscale 7], length 0
03:48:11.566531 IP 220-233-36-47.ip4.exetel.com.au.8538 > muirrust.21116: Flags [.], ack 1, win 255, length 0
03:48:11.566855 IP muirrust.21116 > 220-233-36-47.ip4.exetel.com.au.8538: Flags [P.], seq 1:104, ack 1, win 502, length 103
03:48:11.585492 IP 220-233-36-47.ip4.exetel.com.au.8538 > muirrust.21116: Flags [P.], seq 1:90, ack 104, win 255, length 89
03:48:11.585493 IP 220-233-36-47.ip4.exetel.com.au.8538 > muirrust.21116: Flags [P.], seq 90:202, ack 104, win 255, length 112
03:48:11.585545 IP muirrust.21116 > 220-233-36-47.ip4.exetel.com.au.8538: Flags [.], ack 90, win 502, length 0
03:48:11.585570 IP muirrust.21116 > 220-233-36-47.ip4.exetel.com.au.8538: Flags [.], ack 202, win 502, length 0
03:48:11.585896 IP muirrust.dugongcr.com.21116 > 220-233-36-47.ip4.exetel.com.au.8461: UDP, length 14
03:48:14.403889 IP 220-233-36-47.ip4.exetel.com.au.8652 > muirrust.21116: Flags [S], seq 2810998709, win 65535, options [mss 1460,nop,wscale 8,nop,nop,sackOK], length 0
03:48:14.403956 IP muirrust.21116 > 220-233-36-47.ip4.exetel.com.au.8652: Flags [S.], seq 1688502594, ack 2810998710, win 64240, options [mss 1460,nop,nop,sackOK,nop,wscale 7], length 0
03:48:14.421816 IP 220-233-36-47.ip4.exetel.com.au.8652 > muirrust.21116: Flags [.], ack 1, win 255, length 0
03:48:14.421816 IP 220-233-36-47.ip4.exetel.com.au.8586 > muirrust.21116: UDP, length 85
03:48:14.421816 IP 220-233-36-47.ip4.exetel.com.au.8652 > muirrust.21116: Flags [F.], seq 1, ack 1, win 255, length 0
03:48:14.422067 IP muirrust.dugongcr.com.21116 > 220-233-36-47.ip4.exetel.com.au.8586: UDP, length 3
03:48:14.422199 IP muirrust.21116 > 220-233-36-47.ip4.exetel.com.au.8652: Flags [.], ack 2, win 502, length 0
03:48:14.422299 IP muirrust.21116 > 220-233-36-47.ip4.exetel.com.au.8652: Flags [P.], seq 1:104, ack 2, win 502, length 103
03:48:14.422330 IP muirrust.21116 > 220-233-36-47.ip4.exetel.com.au.8652: Flags [F.], seq 104, ack 2, win 502, length 0
03:48:14.439799 IP 220-233-36-47.ip4.exetel.com.au.8652 > muirrust.21116: Flags [R.], seq 2, ack 104, win 0, length 0
03:48:14.439799 IP 220-233-36-47.ip4.exetel.com.au.8652 > muirrust.21116: Flags [R], seq 2810998711, win 0, length 0
03:48:17.587586 IP 220-233-36-47.ip4.exetel.com.au.8538 > muirrust.21116: Flags [P.], seq 202:314, ack 104, win 255, length 112
03:48:17.587647 IP muirrust.21116 > 220-233-36-47.ip4.exetel.com.au.8538: Flags [.], ack 314, win 502, length 0
03:48:17.587908 IP muirrust.dugongcr.com.21116 > 220-233-36-47.ip4.exetel.com.au.8461: UDP, length 14
03:48:18.393861 IP 220-233-36-47.ip4.exetel.com.au.8586 > muirrust.21116: UDP, length 85
03:48:18.394023 IP muirrust.dugongcr.com.21116 > 220-233-36-47.ip4.exetel.com.au.8586: UDP, length 3
03:48:21.394796 IP 220-233-36-47.ip4.exetel.com.au.8586 > muirrust.21116: UDP, length 85
03:48:21.395010 IP muirrust.dugongcr.com.21116 > 220-233-36-47.ip4.exetel.com.au.8586: UDP, length 5
03:48:24.400801 IP 220-233-36-47.ip4.exetel.com.au.8586 > muirrust.21116: UDP, length 85
03:48:24.400977 IP muirrust.dugongcr.com.21116 > 220-233-36-47.ip4.exetel.com.au.8586: UDP, length 5
03:48:28.389869 IP 220-233-36-47.ip4.exetel.com.au.8586 > muirrust.21116: UDP, length 85
03:48:28.390057 IP muirrust.dugongcr.com.21116 > 220-233-36-47.ip4.exetel.com.au.8586: UDP, length 3
03:48:29.589547 IP 220-233-36-47.ip4.exetel.com.au.8538 > muirrust.21116: Flags [P.], seq 314:426, ack 104, win 255, length 112
03:48:29.589606 IP muirrust.21116 > 220-233-36-47.ip4.exetel.com.au.8538: Flags [.], ack 426, win 502, length 0
03:48:29.589850 IP muirrust.dugongcr.com.21116 > 220-233-36-47.ip4.exetel.com.au.8461: UDP, length 14
03:48:31.398885 IP 220-233-36-47.ip4.exetel.com.au.8586 > muirrust.21116: UDP, length 85
03:48:31.399050 IP muirrust.dugongcr.com.21116 > 220-233-36-47.ip4.exetel.com.au.8586: UDP, length 3
03:48:35.389813 IP 220-233-36-47.ip4.exetel.com.au.8586 > muirrust.21116: UDP, length 85
03:48:35.389971 IP muirrust.dugongcr.com.21116 > 220-233-36-47.ip4.exetel.com.au.8586: UDP, length 3
03:48:36.201190 IP 220-233-36-47.ip4.exetel.com.au.8461 > muirrust.21116: UDP, length 85
03:48:36.201463 IP muirrust.dugongcr.com.21116 > 220-233-36-47.ip4.exetel.com.au.8461: UDP, length 3
03:48:38.396809 IP 220-233-36-47.ip4.exetel.com.au.8586 > muirrust.21116: UDP, length 85
03:48:38.396983 IP muirrust.dugongcr.com.21116 > 220-233-36-47.ip4.exetel.com.au.8586: UDP, length 5
03:48:41.403845 IP 220-233-36-47.ip4.exetel.com.au.8586 > muirrust.21116: UDP, length 85
03:48:41.404027 IP muirrust.dugongcr.com.21116 > 220-233-36-47.ip4.exetel.com.au.8586: UDP, length 5
03:48:45.399916 IP 220-233-36-47.ip4.exetel.com.au.8586 > muirrust.21116: UDP, length 85
03:48:45.400093 IP muirrust.dugongcr.com.21116 > 220-233-36-47.ip4.exetel.com.au.8586: UDP, length 3
03:48:47.591595 IP 220-233-36-47.ip4.exetel.com.au.8538 > muirrust.21116: Flags [F.], seq 426, ack 104, win 255, length 0
03:48:47.591751 IP muirrust.21116 > 220-233-36-47.ip4.exetel.com.au.8538: Flags [F.], seq 104, ack 427, win 502, length 0
03:48:47.609680 IP 220-233-36-47.ip4.exetel.com.au.8538 > muirrust.21116: Flags [.], ack 105, win 255, length 0
03:48:48.401853 IP 220-233-36-47.ip4.exetel.com.au.8586 > muirrust.21116: UDP, length 85
03:48:48.402017 IP muirrust.dugongcr.com.21116 > 220-233-36-47.ip4.exetel.com.au.8586: UDP, length 3

 ack 413088, win 2044, length 36

03:48:52.397870 IP 220-233-36-47.ip4.exetel.com.au.8586 > muirrust.21116: UDP, length 85
03:48:52.398006 IP muirrust.ssh > 220-233-36-47.ip4.exetel.com.au.8618: Flags [P.], seq 419164:419200, ack 59086, win 513, length 36
03:48:52.398113 IP muirrust.dugongcr.com.21116 > 220-233-36-47.ip4.exetel.com.au.8586: UDP, length 3
03:48:55.402910 IP 220-233-36-47.ip4.exetel.com.au.8586 > muirrust.21116: UDP, length 85
03:48:55.403104 IP muirrust.dugongcr.com.21116 > 220-233-36-47.ip4.exetel.com.au.8586: UDP, length 5

**Reply by fufesou** [reply]
How about the network traffic on the client side?

**Reply by rustdesk** [reply]
It somehow the UDP is not working with your client or server. You can build a custom client with out UDP https://rustdesk.com/docs/en/self-host/client-configuration/advanced-settings/#disable-udp 
I believe that will work for you.

**Reply by bearkiter** [reply]
After the client side pcap I think I'm onto a solution, (hint, it's ALWAYS DNS) I'll be sure to post back in case it is what I suspect.
