### DISCUSSION TITLE
Can't Connect to RustDesk on MacOS via Direct IP (RustDesk isn't listening/bound to ports?)

### DISCUSSION THREAD

**Discussion by Nyanino** [rustdesk/rustdesk#14114] [General]
### Bug Description

Hello,

I'm able to connect to my windows machines from RustDesk on my Mac, however, I can't connect to any Mac device through Direct IP.

On my host device, the Mac, I istened on port 21118 (default) to see if there would be connections coming in when I tried to connect via Direct IP. Here is the result from terminal.

```
12:50:38.647129 IP 192.168.50.34.51199 > 192.168.50.171.21118: Flags [SEW], seq 851069177, win 65535, options [mss 1460,nop,wscale 6,nop,nop,TS val 3997754296 ecr 0,sackOK,eol], length 0
12:50:38.647362 IP 192.168.50.171.21118 > 192.168.50.34.51199: Flags [R.], seq 0, ack 851069178, win 0, length 0
12:50:39.671486 IP 192.168.50.34.51199 > 192.168.50.171.21118: Flags [S], seq 851069177, win 65535, options [mss 1460,nop,wscale 6,nop,nop,TS val 3997755297 ecr 0,sackOK,eol], length 0
12:50:39.671585 IP 192.168.50.171.21118 > 192.168.50.34.51199: Flags [R.], seq 0, ack 1, win 0, length 0
```

RustDesk is given screen recording, accessibility, input monitoring, and full disk access on the Mac with a custom set password and direct IP access in settings.

I've tried reinstalling RustDesk, reinstalling MacOS, trying apple host devices, trying different remote devices to connect from.

### How to Reproduce

Install RustDesk on MacOS, enable Direct IP, attempt to connect from remote device.

### Expected Behavior

Connection to host Mac device goes through.

### Operating system(s) on local (controlling) side and remote (controlled) side

MacOS to MacOS, Windows 11 to MacOS, iOS to MacOS

### RustDesk Version(s) on local (controlling) side and remote (controlled) side

1.4.5 to 1.4.5

### Screenshots

<img width="585" height="1266" alt="Image" src="https://github.com/user-attachments/assets/1147612c-9a49-4044-b7a5-0e2e206a30e5" />

**Comment by cleitoncarvalho** [comment]
Not sure if it is related, but i just updated to 1.4.5, and can't connect directly either. Windows to Windows and Android to Windows in my case. I tried downgrading and it's present on 1.4.4 as well. Direct IP Connection from a 1.4.5 to a 1.4.3 machine works though, but not to a 1.4.5 nor 1.4.4.

**Comment by Nyanino** [comment]
Resolved by starting the service on MacOS devices so they can listen to the ports. Conversely, this doesn't seem to be the same expected behavior on Windows. It doesn't seem that the service must be started on Windows.

**Reply by netExtra** [reply]
> Resolved by starting the service on MacOS devices so they can listen to the ports. Conversely, this doesn't seem to be the same expected behavior on Windows. It doesn't seem that the service must be started on Windows.

I already have the service running on MacOS and it's still not working. I'm using it with Docker but it works with some releases then I update and it stops working, then update and it works again.
