### ISSUE TITLE
Can't Connect to RustDesk on MacOS via Direct IP (RustDesk isn't listening/bound to ports?)

### ISSUE THREAD

**Issue by Nyanino** [rustdesk/rustdesk#14109]
### Bug Description

Hello,

I'm able to connect to my windows machines from RustDesk on my Mac, however, I can't connect to any Mac device through Direct IP.

On my host device, the Mac, I istened on port 21118 (default) to see if there would be connections coming in when I tried to connect via Direct IP. Here is the result from terminal.

```
12:50:38.647129 IP 192.168.50.34.51199 > 192.168.50.171.21118: Flags [SEW], seq 851069177, win 65535, options [mss 1460,nop,wscale 6,nop,nop,TS val 3997754296 ecr 0,sackOK,eol], length 0
12:50:38.647362 IP 192.168.50.171.21118 > 192.168.50.34.51199: Flags [R.], seq 0, ack 851069178, win 0, length 0
12:50:39.671486 IP 192.168.50.34.51199 > 192.168.50.171.21118: Flags [S], seq 851069177, win 65535, options [mss 1460,nop,wscale 6,nop,nop,TS val 3997755297 ecr 0,sackOK,eol], length 0
12:50:39.671585 IP 192.168.50.171.21118 > 192.168.50.34.51199: Flags [R.], seq 0, ack 1, win 0, length 0
```

RustDesk is given screen recording, accessibility, input monitoring, and full disk access on the Mac with a custom set password and direct IP access in settings.

I've tried reinstalling RustDesk, reinstalling MacOS, trying apple host devices, trying different remote devices to connect from.

### How to Reproduce

Install RustDesk on MacOS, enable Direct IP, attempt to connect from remote device.

### Expected Behavior

Connection to host Mac device goes through.

### Operating system(s) on local (controlling) side and remote (controlled) side

MacOS to MacOS, Windows 11 to MacOS, iOS to MacOS

### RustDesk Version(s) on local (controlling) side and remote (controlled) side

1.4.5 to 1.4.5

### Screenshots

<img width="585" height="1266" alt="Image" src="https://github.com/user-attachments/assets/1147612c-9a49-4044-b7a5-0e2e206a30e5" />
